{
  "schema_version": "inlumen.artifact-contract@4",
  "transport": "filesystem",
  "artifacts_per_connection": 1,
  "input_environment": "PIPELINE_INPUT_DIR",
  "output_environment": "PIPELINE_OUTPUT_DIR",
  "recursive": true,
  "input_layout": "<artifact-relative-path>",
  "output_layout": "<artifact-relative-path>",
  "port_namespaced": false,
  "run_isolation": "<run_id>",
  "source_agnostic": true,
  "connector_agnostic": true
}
